{
  "domain": "joint-enforcement-secrecy",
  "version": 2,
  "sample_id": "sample-015",
  "case_file": {
    "case_id": "虚构案-2026-云溪-07",
    "title": "云溪“杏林回春”虚构骗保专案（全部要素虚构）",
    "director_ids": [
      "p-yin",
      "p-hao"
    ],
    "core_entries": [
      {
        "entry_id": "ce-suspect-a",
        "kind": "suspect",
        "label": "嫌疑人甲（虚构代号“郎中”）",
        "initial": true
      },
      {
        "entry_id": "ce-warehouse-a",
        "kind": "warehouse",
        "label": "枫林里假票据仓库（虚构地点）",
        "initial": true
      },
      {
        "entry_id": "ce-fund-a",
        "kind": "fund-account",
        "label": "过桥账户组 F-07（虚构账号）",
        "initial": true
      },
      {
        "entry_id": "ce-suspect-b",
        "kind": "suspect",
        "label": "嫌疑人乙（虚构代号“账房”）",
        "initial": false,
        "added_via_event_id": "ev-013"
      }
    ]
  },
  "roles": [
    {
      "role_id": "r-director",
      "name": "案件负责人"
    },
    {
      "role_id": "r-field-checker",
      "name": "基层核查员"
    },
    {
      "role_id": "r-investigator",
      "name": "侦查员"
    },
    {
      "role_id": "r-analyst",
      "name": "资金分析员"
    },
    {
      "role_id": "r-auxiliary",
      "name": "辅警钟点工"
    },
    {
      "role_id": "r-prosecutor",
      "name": "检察承办人"
    }
  ],
  "persons": [
    {
      "person_id": "p-yin",
      "name": "殷岚（虚构）",
      "unit": "云溪医保分局",
      "role_ids": [
        "r-director"
      ]
    },
    {
      "person_id": "p-hao",
      "name": "郝建（虚构）",
      "unit": "云溪公安分局",
      "role_ids": [
        "r-director"
      ]
    },
    {
      "person_id": "p-lu",
      "name": "卢笛（虚构）",
      "unit": "云溪医保分局",
      "role_ids": [
        "r-field-checker"
      ]
    },
    {
      "person_id": "p-xing",
      "name": "邢默（虚构）",
      "unit": "云溪公安分局",
      "role_ids": [
        "r-investigator"
      ]
    },
    {
      "person_id": "p-mai",
      "name": "麦琪（虚构）",
      "unit": "云溪公安分局",
      "role_ids": [
        "r-investigator",
        "r-analyst"
      ]
    },
    {
      "person_id": "p-chang",
      "name": "常烁（虚构）",
      "unit": "云溪公安分局",
      "role_ids": [
        "r-auxiliary"
      ],
      "transferred_away_at": "2026-03-11T00:00:00+08:00"
    },
    {
      "person_id": "p-kuang",
      "name": "邝介（虚构）",
      "unit": "云溪区检察院",
      "role_ids": [
        "r-prosecutor"
      ]
    }
  ],
  "compartments": [
    {
      "compartment_id": "c-routine",
      "name": "日常检查舱",
      "owner_ids": [
        "p-yin"
      ],
      "unseal_conditions": [
        {
          "type": "scheduled",
          "at": "2026-03-02T08:00:00+08:00"
        }
      ]
    },
    {
      "compartment_id": "c-core",
      "name": "核心侦查舱（嫌疑人/仓库/资金身份）",
      "owner_ids": [
        "p-yin",
        "p-hao"
      ],
      "unseal_conditions": [
        {
          "type": "manual",
          "approver_ids": [
            "p-yin",
            "p-hao"
          ]
        }
      ]
    },
    {
      "compartment_id": "c-finance",
      "name": "资金分析舱",
      "owner_ids": [
        "p-hao"
      ],
      "unseal_conditions": [
        {
          "type": "batch_activated",
          "batch_id": "b-raid"
        }
      ]
    },
    {
      "compartment_id": "c-prosecution",
      "name": "起诉移送舱",
      "owner_ids": [
        "p-hao"
      ],
      "unseal_conditions": [
        {
          "type": "scheduled",
          "at": "2026-03-25T09:00:00+08:00"
        }
      ]
    }
  ],
  "batches": [
    {
      "batch_id": "b-routine",
      "name": "一季度例行稽核批次",
      "compartment_id": "c-routine",
      "planned_at": "2026-03-02T08:00:00+08:00"
    },
    {
      "batch_id": "b-raid",
      "name": "同步收网批次",
      "compartment_id": "c-core",
      "planned_at": "2026-03-16T06:00:00+08:00"
    }
  ],
  "materials": [
    {
      "material_id": "m-pub-record",
      "name": "枫林里药店日常检查记录（虚构）",
      "classification": "public-inspection",
      "compartment_id": "c-routine"
    },
    {
      "material_id": "m-suspect-dossier",
      "name": "嫌疑人甲侦控卷宗（虚构）",
      "classification": "case-evidence",
      "compartment_id": "c-core",
      "core_entry_id": "ce-suspect-a"
    },
    {
      "material_id": "m-warehouse-watch",
      "name": "仓库蹲守影像清单（虚构）",
      "classification": "case-evidence",
      "compartment_id": "c-core",
      "core_entry_id": "ce-warehouse-a"
    },
    {
      "material_id": "m-fund-flow",
      "name": "F-07 资金流向分析（虚构）",
      "classification": "case-evidence",
      "compartment_id": "c-finance",
      "core_entry_id": "ce-fund-a"
    },
    {
      "material_id": "m-evidence-pack",
      "name": "移送公安证据汇编（虚构）",
      "classification": "case-evidence",
      "compartment_id": "c-core",
      "core_entry_id": "ce-suspect-a",
      "derived_from": [
        {
          "material_id": "m-suspect-dossier",
          "relation": "extract",
          "excerpt_ref": "节录本-0320#第2-5页"
        },
        {
          "material_id": "m-pub-record",
          "relation": "intake"
        }
      ]
    },
    {
      "material_id": "m-prosecution-brief",
      "name": "起诉意见书附证据副本（虚构）",
      "classification": "prosecution-copy",
      "compartment_id": "c-prosecution",
      "derived_from": [
        {
          "material_id": "m-evidence-pack",
          "relation": "copy"
        },
        {
          "material_id": "m-fund-flow",
          "relation": "copy"
        }
      ]
    }
  ],
  "leads": [
    {
      "lead_id": "l-fenglin-pharmacy",
      "name": "枫林里药店刷卡异常线索（虚构）",
      "compartment_id": "c-routine",
      "linked_core_entry_ids": [
        "ce-suspect-a"
      ],
      "link_condition": {
        "type": "batch_activated",
        "batch_id": "b-raid"
      }
    }
  ],
  "grants": [
    {
      "grant_id": "g-yin-routine",
      "person_id": "p-yin",
      "compartment_id": "c-routine",
      "actions": [
        "view",
        "grant-temp"
      ]
    },
    {
      "grant_id": "g-lu-routine",
      "person_id": "p-lu",
      "compartment_id": "c-routine",
      "actions": [
        "view",
        "excerpt"
      ]
    },
    {
      "grant_id": "g-chang-temp",
      "person_id": "p-chang",
      "compartment_id": "c-routine",
      "actions": [
        "excerpt"
      ],
      "temp": true,
      "valid_from": "2026-03-03T08:30:00+08:00",
      "expires_at": "2026-03-05T18:00:00+08:00",
      "basis_event_id": "ev-004"
    },
    {
      "grant_id": "g-mai-temp",
      "person_id": "p-mai",
      "compartment_id": "c-routine",
      "actions": [
        "view"
      ],
      "temp": true,
      "valid_from": "2026-03-08T09:00:00+08:00",
      "expires_at": "2026-03-12T18:00:00+08:00",
      "basis_event_id": "ev-006"
    },
    {
      "grant_id": "g-yin-core",
      "person_id": "p-yin",
      "compartment_id": "c-core",
      "actions": [
        "view",
        "transfer"
      ],
      "core_clearance": true
    },
    {
      "grant_id": "g-xing-core",
      "person_id": "p-xing",
      "compartment_id": "c-core",
      "actions": [
        "view",
        "excerpt",
        "transfer",
        "grant-temp"
      ],
      "core_clearance": true
    },
    {
      "grant_id": "g-mai-core-temp",
      "person_id": "p-mai",
      "compartment_id": "c-core",
      "actions": [
        "view"
      ],
      "core_clearance": true,
      "temp": true,
      "valid_from": "2026-03-19T10:00:00+08:00",
      "expires_at": "2026-03-21T10:00:00+08:00",
      "basis_event_id": "ev-014"
    },
    {
      "grant_id": "g-mai-finance",
      "person_id": "p-mai",
      "compartment_id": "c-finance",
      "actions": [
        "view"
      ],
      "core_clearance": true
    },
    {
      "grant_id": "g-xing-prosecution",
      "person_id": "p-xing",
      "compartment_id": "c-prosecution",
      "actions": [
        "transfer"
      ]
    }
  ],
  "events": [
    {
      "event_id": "ev-001",
      "seq": 1,
      "at": "2026-03-02T08:00:00+08:00",
      "actor": "p-yin",
      "action": "compartment-unsealed",
      "payload": {
        "compartment_id": "c-routine"
      },
      "prev_hash": null,
      "hash": "005936c2880223d02375219f248f1be088dfc005452de91bf84eb87fe3c329fc"
    },
    {
      "event_id": "ev-002",
      "seq": 2,
      "at": "2026-03-02T08:05:00+08:00",
      "actor": "p-yin",
      "action": "batch-activated",
      "payload": {
        "batch_id": "b-routine"
      },
      "prev_hash": "005936c2880223d02375219f248f1be088dfc005452de91bf84eb87fe3c329fc",
      "hash": "0d47c4affb4b9db13da8fabe0544937b6b3d4f3160f8d5d2b590438686cd1e1d"
    },
    {
      "event_id": "ev-003",
      "seq": 3,
      "at": "2026-03-02T09:12:00+08:00",
      "actor": "p-lu",
      "action": "view",
      "payload": {
        "material_ids": [
          "m-pub-record"
        ],
        "note": "日常检查前调阅药店档案"
      },
      "prev_hash": "0d47c4affb4b9db13da8fabe0544937b6b3d4f3160f8d5d2b590438686cd1e1d",
      "hash": "46c3c1abf9cdcc7b20e3f2ca0da2e7b778cd4f6839baafeb6da94cdc161f5395"
    },
    {
      "event_id": "ev-004",
      "seq": 4,
      "at": "2026-03-03T08:30:00+08:00",
      "actor": "p-yin",
      "action": "temp-grant",
      "payload": {
        "grant_id": "g-chang-temp",
        "compartment_id": "c-routine",
        "justification": "协助摘录近三个月刷卡台账，限两个工作日"
      },
      "prev_hash": "46c3c1abf9cdcc7b20e3f2ca0da2e7b778cd4f6839baafeb6da94cdc161f5395",
      "hash": "5c36c1f30065f50880bad43c3495974f2db97ddf9ffe7e1205f2b287baa5a9f0"
    },
    {
      "event_id": "ev-005",
      "seq": 5,
      "at": "2026-03-03T09:05:00+08:00",
      "actor": "p-chang",
      "action": "excerpt",
      "payload": {
        "material_ids": [
          "m-pub-record"
        ],
        "excerpt_ref": "台账摘录-0303"
      },
      "prev_hash": "5c36c1f30065f50880bad43c3495974f2db97ddf9ffe7e1205f2b287baa5a9f0",
      "hash": "814c4344903c30ab9aa42c093b5c7caaebe5869ee01d71efc2453e685db18b55"
    },
    {
      "event_id": "ev-006",
      "seq": 6,